{
  "schemaVersion": 1,
  "target": {
    "width": 1280,
    "height": 720,
    "fps": 60
  },
  "render": {
    "p90Ms": 16.7,
    "p99Ms": 22.5,
    "maxSlowFrames": 8,
    "maxResourceChurnEvents": 4,
    "maxUploadBytes": 262144,
    "maxP0": 0,
    "maxP1": 0,
    "scenes": {
      "blockkart-quickplay-baseline": {
        "p90Ms": 16.7,
        "p99Ms": 22.5,
        "maxSlowFrames": 8,
        "maxResourceChurnEvents": 2,
        "maxUploadBytes": 262144
      },
      "blockkart-primitive-10k": {
        "p90Ms": 24,
        "p99Ms": 110,
        "maxSlowFrames": 60,
        "maxResourceChurnEvents": 4,
        "maxUploadBytes": 1048576
      },
      "blockkart-water": {
        "p90Ms": 48,
        "p99Ms": 110,
        "maxSlowFrames": 80,
        "maxResourceChurnEvents": 4,
        "maxUploadBytes": 1048576
      },
      "blockkart-resource-churn-soak": {
        "p90Ms": 60,
        "p99Ms": 110,
        "maxSlowFrames": 80,
        "maxResourceChurnEvents": 4,
        "maxUploadBytes": 1048576
      },
      "blockkart-resize-recreate-targets": {
        "p90Ms": 16.7,
        "p99Ms": 22.5,
        "maxSlowFrames": 8,
        "maxResourceChurnEvents": 4,
        "maxUploadBytes": 262144
      },
      "blockkart-restart-50": {
        "p90Ms": 16.7,
        "p99Ms": 50,
        "maxSlowFrames": 80,
        "maxResourceChurnEvents": 4,
        "maxUploadBytes": 262144
      }
    }
  },
  "physics": {
    "maxVelocity": 72,
    "maxAngularVelocity": 24,
    "maxReplayDriftMeters": 0.01,
    "maxLongStuckSeconds": 3,
    "maxP0": 0,
    "maxP1": 0
  }
}
